{"capabilities":{"consistency":"eventual-after-committed-workflow","deletion":"audit-preserving-tombstone; Git history remains public","limits":{"array_items":100,"command_bytes":16384,"events":10000,"fields_per_collection":32,"generated_collection_bytes":2097152,"issue_body_bytes":32768,"issues_per_reconcile":100,"json_depth":8,"json_nodes":512,"object_keys":64,"records_per_collection":500,"requests":10000,"snapshot_items":500,"string_bytes":4096},"read":{"cors":true,"snapshot":"one-complete-bounded-page","transport":"static-json"},"unsupported":["custom authentication","private or personal data","files or uploads","hard deletion","arbitrary code or hooks","outbound URL fetching","server-side realtime","low-latency writes"],"write":{"authentication":"GitHub issue author numeric user id","command_schema":"rapp-base-command/1.0","issue_url":"https://github.com/kody-w/rapp-base/issues/new?template=rapp-base-command.yml","labels_authoritative":false,"one_command_per_issue":true,"title_prefix":"[RAPP Base]","transport":"github-issue-form"}},"collections":[{"count":2,"description":"Small public apps and experiments built around useful, open data.","fields":{"category":{"enum":["data","developer-tool","education","productivity"],"required":true,"type":"string"},"description":{"maxLength":500,"minLength":8,"required":true,"type":"string"},"featured":{"required":true,"type":"boolean"},"homepage":{"format":"url","maxLength":500,"required":true,"type":"string"},"name":{"maxLength":80,"minLength":2,"required":true,"type":"string","unique":true},"stars":{"max":1000000000,"min":0,"required":true,"type":"integer"},"tags":{"maxLength":8,"minLength":1,"required":true,"type":"string[]"}},"immutable_url":"https://raw.githubusercontent.com/kody-w/rapp-base/main/versions/collections/rapps/b22bd09e3547.json","name":"rapps","policies":{"create":"public","delete":"owner","update":"owner"},"record_url_template":"https://raw.githubusercontent.com/kody-w/rapp-base/main/api/v1/collections/rapps/records/{id}.json","records_url":"https://raw.githubusercontent.com/kody-w/rapp-base/main/api/v1/collections/rapps/records.json","snapshot_sha256":"b22bd09e354732c36848e124ca2865a492c9321d2ae08d8163e24457ff1d19b2","version_url_template":"https://raw.githubusercontent.com/kody-w/rapp-base/main/versions/records/rapps/{id}/{sha8}.json"},{"count":3,"description":"Curated links to durable, openly accessible learning resources.","fields":{"free":{"required":true,"type":"boolean"},"kind":{"enum":["article","documentation","course","tool"],"required":true,"type":"string"},"rating":{"max":5,"min":0,"required":true,"type":"number"},"summary":{"maxLength":500,"minLength":8,"required":true,"type":"string"},"title":{"maxLength":120,"minLength":2,"required":true,"type":"string","unique":true},"topics":{"maxLength":8,"minLength":1,"required":true,"type":"string[]"},"url":{"format":"url","maxLength":500,"required":true,"type":"string","unique":true}},"immutable_url":"https://raw.githubusercontent.com/kody-w/rapp-base/main/versions/collections/resources/5445c5b0b3df.json","name":"resources","policies":{"create":"public","delete":"owner","update":"owner"},"record_url_template":"https://raw.githubusercontent.com/kody-w/rapp-base/main/api/v1/collections/resources/records/{id}.json","records_url":"https://raw.githubusercontent.com/kody-w/rapp-base/main/api/v1/collections/resources/records.json","snapshot_sha256":"5445c5b0b3df059798d7e49831014c5c4f685e2d788cfa66005e4fc9992baaf9","version_url_template":"https://raw.githubusercontent.com/kody-w/rapp-base/main/versions/records/resources/{id}/{sha8}.json"}],"entries":[{"name":"status","schema":"rapp-base-status/1.0","url":"https://raw.githubusercontent.com/kody-w/rapp-base/main/api/v1/status.json"},{"name":"collections","schema":"rapp-base-collections/1.0","url":"https://raw.githubusercontent.com/kody-w/rapp-base/main/api/v1/collections.json"},{"name":"events","schema":"rapp-base-event-index/1.0","url":"https://raw.githubusercontent.com/kody-w/rapp-base/main/api/v1/events/index.json"},{"name":"receipts","schema":"rapp-base-receipt-index/1.0","url":"https://raw.githubusercontent.com/kody-w/rapp-base/main/api/v1/receipts/index.json"},{"name":"versions","schema":"rapp-base-version-index/1.0","url":"https://raw.githubusercontent.com/kody-w/rapp-base/main/versions/index.json"}],"events_url":"https://raw.githubusercontent.com/kody-w/rapp-base/main/api/v1/events/index.json","generated":"2026-07-18T20:55:03Z","generated_at":"2026-07-18T20:55:03Z","generation_sha256":"aa9d0a9ec55f4e1d9e5c26b44bd886b0f7e111232e948c24438b9fc96e55e6f4","generator":"rapp-base-builder/1.0","immutable_request_versions":[{"issue_id":4920013834,"path":"versions/requests/165975feac6e.json","request_hash":"cf439d4e050eea4f595407e0fccd0e316cb77c91527893c6fe3d7aefd81acc67"},{"issue_id":4920017094,"path":"versions/requests/3679a7d80a86.json","request_hash":"d966407e869c7f11f27bfa04560e707393c2d6a05e38bfc755ef3de6031305c1"}],"name":"RAPP Base","pages_base":"https://kody-w.github.io/rapp-base/","profile":"rapp-base/1.0","raw_base":"https://raw.githubusercontent.com/kody-w/rapp-base/main","receipts_url":"https://raw.githubusercontent.com/kody-w/rapp-base/main/api/v1/receipts/index.json","repository":{"branch":"main","name":"rapp-base","owner":"kody-w"},"schema":"rapp-static-api/1.0","status_url":"https://raw.githubusercontent.com/kody-w/rapp-base/main/api/v1/status.json","summary":{"collections":2,"events":2,"receipts":2,"requests":2},"versions_url":"https://raw.githubusercontent.com/kody-w/rapp-base/main/versions/index.json"}
